{"schema_version":"1","analysis_rev":"fx-0001","producer_commit":"w0-fixture","input_artifact_hashes":{},"cam_id":"dashcam","chunk_t0_ms":0,"rows":[[1200,2,"car",295.9,152.7,306.8,161.0,0.9],[1300,2,"car",295.1,152.7,306.4,161.2,0.9],[1400,2,"car",294.2,152.7,306.0,161.5,0.9],[1500,2,"car",293.2,152.6,305.5,161.8,0.9],[1600,2,"car",292.2,152.6,305.0,162.1,0.9],[1700,2,"car",291.1,152.5,304.5,162.4,0.9],[1800,2,"car",290.0,152.5,303.9,162.8,0.9],[1900,2,"car",288.7,152.4,303.3,163.2,0.9],[2000,2,"car",287.3,152.4,302.6,163.6,0.9],[2100,2,"car",285.8,152.3,301.9,164.0,0.9],[2200,2,"car",284.1,152.2,301.1,164.5,0.9],[2300,2,"car",282.3,152.2,300.2,165.1,0.9],[2400,2,"car",280.3,152.1,299.3,165.7,0.9],[2500,2,"car",278.0,152.0,298.2,166.4,0.9],[2600,2,"car",275.5,151.9,297.1,167.2,0.9],[2700,2,"car",272.6,151.7,295.8,168.0,0.9],[2800,2,"car",269.4,151.6,294.4,169.0,0.9],[2900,2,"car",265.7,151.4,292.8,170.1,0.9],[3000,1,"person",377.2,149.6,383.2,167.3,0.88],[3000,2,"car",261.4,151.3,291.0,171.4,0.9],[3100,1,"person",376.7,149.5,382.9,167.7,0.88],[3100,2,"car",256.4,151.1,288.9,173.0,0.9],[3200,1,"person",376.3,149.3,382.6,168.1,0.88],[3200,2,"car",250.5,150.8,286.5,174.8,0.9],[3300,1,"person",375.7,149.2,382.3,168.5,0.88],[3300,2,"car",243.4,150.5,283.7,177.0,0.9],[3400,1,"person",375.2,149.0,381.9,168.9,0.88],[3400,2,"car",234.7,150.2,280.4,179.7,0.9],[3500,1,"person",374.6,148.9,381.5,169.4,0.88],[3500,2,"car",223.9,149.7,276.5,183.1,0.9],[3600,1,"person",374.0,148.7,381.1,169.9,0.88],[3600,2,"car",210.1,149.1,271.7,187.6,0.9],[3700,1,"person",373.4,148.5,380.7,170.4,0.88],[3700,2,"car",191.9,148.4,265.7,193.7,0.9],[3800,1,"person",372.7,148.3,380.3,171.0,0.88],[3800,2,"car",167.3,147.4,258.1,202.2,0.9],[3900,1,"person",371.9,148.1,379.8,171.6,0.88],[3900,2,"car",132.4,146.0,248.1,215.2,0.9],[4000,1,"person",371.1,147.8,379.3,172.3,0.88],[4000,2,"car",81.4,144.1,234.3,236.5,0.9],[4100,1,"person",370.2,147.6,378.7,173.0,0.88],[4100,2,"car",5.8,141.6,214.4,275.0,0.9],[4200,1,"person",369.3,147.3,378.1,173.7,0.88],[4200,2,"car",0.0,141.6,183.5,346.0,0.9],[4300,1,"person",368.3,147.0,377.4,174.5,0.88],[4400,1,"person",367.2,146.7,376.7,175.4,0.88],[4500,1,"person",366.0,146.3,375.9,176.4,0.88],[4600,1,"person",364.6,145.9,375.0,177.5,0.88],[4700,1,"person",363.2,145.5,374.1,178.7,0.88],[4800,1,"person",361.6,145.0,373.0,180.0,0.88],[4900,1,"person",359.8,144.5,371.8,181.5,0.88],[5000,1,"person",357.8,143.9,370.5,183.1,0.88],[5100,1,"person",355.5,143.2,368.9,185.0,0.88],[5200,1,"person",352.8,142.5,367.0,186.9,0.88],[5300,1,"person",349.6,141.7,364.6,189.0,0.88],[5400,1,"person",346.0,140.9,361.7,191.2,0.88],[5500,1,"person",341.7,140.1,358.3,193.6,0.88],[5600,1,"person",336.9,139.2,354.3,196.1,0.88],[5700,1,"person",331.4,138.2,349.5,198.7,0.88],[5800,1,"person",325.2,137.3,344.0,201.4,0.88],[5900,1,"person",318.0,136.3,337.6,204.2,0.88],[6000,1,"person",309.6,135.3,330.4,207.0,0.88],[6100,1,"person",300.3,134.2,322.2,209.9,0.88],[6200,1,"person",290.2,133.2,313.7,212.8,0.88],[6300,1,"person",279.3,132.3,304.7,215.5,0.88],[6400,1,"person",267.7,131.4,295.0,218.1,0.88],[6500,1,"person",255.7,130.7,284.8,220.3,0.88],[6600,1,"person",243.3,130.1,274.2,222.5,0.88],[6700,1,"person",230.1,129.4,262.9,224.8,0.88],[6800,1,"person",216.2,128.8,251.0,227.3,0.88],[6900,1,"person",201.5,128.2,238.3,229.9,0.88],[7000,1,"person",186.1,127.6,224.9,232.7,0.88],[7100,1,"person",169.8,127.1,210.8,235.6,0.88],[7200,1,"person",152.8,126.6,195.8,238.7,0.88],[7300,1,"person",135.0,126.2,180.0,241.9,0.88],[7400,1,"person",116.5,125.9,163.4,245.3,0.88],[7500,1,"person",97.4,125.7,146.0,248.8,0.88],[7600,1,"person",77.8,125.6,127.9,252.3,0.88],[7700,1,"person",57.7,125.8,109.1,256.0,0.88],[7800,1,"person",37.4,126.1,89.7,259.6,0.88],[7900,1,"person",16.9,126.7,69.8,263.3,0.88]]}
